{
  "created_at": "2026-09-06T13:17:57Z",
  "id": "HO-0006",
  "ir_ref": "#161",
  "payload": {
    "answer_ref": {
      "sealed_sha256": "4f1f52c989f5133c0909a9ac1e33ed807c98fb51acb3269d8001c0621dbbe213",
      "stronghold": "answers/field-level/HO-0006.answers.json"
    },
    "repo_hint": "Cloudbird-Software（组织级）",
    "task": "陌生 agent 仅读 AGENTS.md 找到并认领一张 state:ready 卡（宪法 §11 统一入口验收判据的复测场景）"
  },
  "sealed_by": "randypanding（owner 2026-09-06 会话授权 agent 执行迁移重封——ADR-0109 回签附录/IR-0010 卡 B2 批次二）",
  "sealed_sha256": "000426bba1af21bbbc451cbd10ef72eb0bd251c0ffe4e46f9b5364893665a8c2",
  "type": "agent-trajectory"
}
