{
  "created_at": "2026-09-06T13:17:57Z",
  "id": "HO-0002",
  "ir_ref": "#161",
  "payload": {
    "answer_ref": {
      "sealed_sha256": "f47bd1d79f94cb9f08cdd77047fa9de2c0f9beb3861bbba8754a6e7ad276c0a3",
      "stronghold": "answers/field-level/HO-0002.answers.json"
    },
    "input": {
      "format": "short-video-script",
      "pitch": "30 秒竖屏短剧：加班到深夜的程序员收到外卖备注'记得吃饭'"
    },
    "kind": "script-structure-golden",
    "repo_hint": "Script_Writer"
  },
  "sealed_by": "randypanding（owner 2026-09-06 会话授权 agent 执行迁移重封——ADR-0109 回签附录/IR-0010 卡 B2 批次二）",
  "sealed_sha256": "020dbfa97ceba711a30196dc6726cc41cf6b7e1a7db0ea88042f13102595b7b6",
  "type": "golden"
}
