{
  "created_at": "2026-09-06T13:17:57Z",
  "id": "HO-0001",
  "ir_ref": "#161",
  "payload": {
    "answer_ref": {
      "sealed_sha256": "362e64caf01b4ca9b03a4214c05338d08ba42965970be514e269a6d914bdb73f",
      "stronghold": "answers/field-level/HO-0001.answers.json"
    },
    "given": {
      "candidate_pool": [
        {
          "item": "i1",
          "tags": [
            "go"
          ]
        },
        {
          "item": "i2",
          "tags": [
            "baml",
            "go"
          ]
        },
        {
          "item": "i3",
          "tags": [
            "lint",
            "go"
          ]
        }
      ],
      "top_k": 2,
      "users": [
        {
          "id": "u1",
          "prefs": [
            "go",
            "baml"
          ]
        },
        {
          "id": "u2",
          "prefs": [
            "go",
            "lint"
          ]
        }
      ]
    },
    "repo_hint": "mutual",
    "scenario": "同质偏好双人组的互惠推荐（envy-freeness）",
    "when": "为 u1/u2 各生成 top-2 推荐列表（互惠目标：一方的推荐对另一方亦高价值）"
  },
  "sealed_by": "randypanding（owner 2026-09-06 会话授权 agent 执行迁移重封——ADR-0109 回签附录/IR-0010 卡 B2 批次二）",
  "sealed_sha256": "a654407c542d17374870149f8f48ef99641948e0898c3335cf721ea4f46f70b9",
  "type": "e2e-scenario"
}
