{
  "ac_ref": "IR-0003/W1-C4/AC-2",
  "created_at": "2026-09-06T13:17:57Z",
  "id": "HO-0003",
  "payload": {
    "answer_ref": {
      "sealed_sha256": "5e3398f02968784404bde15bf5d16108924732c359c45d0ea5834764f2bcc350",
      "stronghold": "answers/field-level/HO-0003.answers.json"
    },
    "input": {
      "agents": [
        "a1",
        "a2",
        "a3"
      ],
      "preference_matrix_rows_agents_cols_slots": [
        [
          2,
          1,
          0
        ],
        [
          1,
          0,
          2
        ],
        [
          0,
          2,
          1
        ]
      ],
      "slots": [
        "s1",
        "s2",
        "s3"
      ]
    },
    "kind": "matching-golden",
    "repo_hint": "mutual"
  },
  "sealed_by": "randypanding（owner 2026-09-06 会话授权 agent 执行迁移重封——ADR-0109 回签附录/IR-0010 卡 B2 批次二）",
  "sealed_sha256": "c8694487fb3c4910a1e6f4f385e47c13a8756035ef14b897936ae918838f49d9",
  "type": "golden"
}
