{
  "created_at": "2026-09-06T13:17:57Z",
  "id": "HO-0010",
  "ir_ref": "#107",
  "payload": {
    "answer_ref": {
      "sealed_sha256": "a39d22ebb1dff67c32500df459d790b036017f1460dca80dcf2645a46c44122a",
      "stronghold": "answers/field-level/HO-0010.answers.json"
    },
    "form": "GEN_FORM_4_OWNER_TALK",
    "input_spec": {
      "portrait_image": "1 张店主正面照（公开图库或合成，面部无遮挡）",
      "script": "由 script_seed 派生的 ≤6 秒口播文案（品牌名 + 卖点 + 行动号召三要素齐全）",
      "voice": "TTS 合成语音（默认音色，无需克隆）"
    },
    "merchant_mock": {
      "category": "美业",
      "name": "静颜皮肤管理",
      "one_liner": "用心做好每一次护理",
      "persona": "店主女性，正面半身照（公开图库或合成人像，含清晰正脸）",
      "script_seed": {
        "brand": "静颜皮肤管理",
        "cta": "到店咨询，本周预约有礼",
        "selling_point": "焕肤护理首体验"
      }
    },
    "scenario": "form4-owner-talk-e2e"
  },
  "sealed_by": "randypanding（owner 2026-09-06 会话授权 agent 执行迁移重封——ADR-0109 回签附录/IR-0010 卡 B2 批次二）",
  "sealed_sha256": "7b79ecdc349c815be0886758b8c9b34b07cafc559262d753b67aa9217a995a66",
  "type": "e2e-scenario"
}
