{
  "created_at": "2026-09-06T13:17:57Z",
  "id": "HO-0009",
  "ir_ref": "#107",
  "payload": {
    "answer_ref": {
      "sealed_sha256": "3523e1accd83e35d7d425a6a08ed9f23ac8934295e6aafa2565fe5c13afa721a",
      "stronghold": "answers/field-level/HO-0009.answers.json"
    },
    "form": "GEN_FORM_1_BREATHE",
    "input_spec": {
      "info_sheet": "merchant_mock 全字段",
      "seed_images": "1 张菜品实拍风格静态图（公开图库或合成，主体居中、9:16 或可裁切）"
    },
    "merchant_mock": {
      "address": "锦江区幸福路12号",
      "category": "餐饮",
      "headline_item": {
        "name": "招牌笋子烧牛肉",
        "price": "42元"
      },
      "name": "巷口小馆",
      "one_liner": "现烧现上，一锅一灶",
      "phone": "028-8888-6666"
    },
    "scenario": "form1-breathe-e2e"
  },
  "sealed_by": "randypanding（owner 2026-09-06 会话授权 agent 执行迁移重封——ADR-0109 回签附录/IR-0010 卡 B2 批次二）",
  "sealed_sha256": "ae1468737264c6b7a7a5ee32c613883b5998c66cb30bc9bcb47ded45f44408d2",
  "type": "e2e-scenario"
}
